Name;Category;Keywords;Level;Requirements;Text;Summary
Saving Grace;Leader Heal;Role, Leader;4;Leader role;When you use a Healing power, creatures spending a Surge due to that power can make a Saving Throw to end an effect that a save can end or to ignore a condition during their next turn.;Healing grants free Saving Throw.
Shield Mate;Leader Heal;Role, Leader;4;Leader role;When you grant Temporary Hit Points to an ally, increase the THP by 2 per tier.;Temporary Hit Points granted to allies increased by 2 per tier.
Word of Caution;Leader Maneuver;Role, Leader;4;Leader role;"When you use a Healing power, creatures spending a Surge due to that power gain +1 to all defenses until the end of your next turn.
When you grant a power bonus to a defense to an ally, that bonus is increased by 1.";Healing grants +1 to defenses. Power bonuses to a defense increased by 1 on allies.
Fast Healing;Leader Maneuver;Role, Leader;4;Leader role;"When you use a Healing power, creatures spending a Surge due to that power gain +3 Movement Speed until the end of your next turn.
When you grant an action to an ally, any movement or shift in that action is increased by 1.
When you grant forced movement to an ally, the forced movement is increased by 1.";Healing grants +3 Movement Speed. On actions granted to allies, +1 Movement Speed and +1 Shift. Forced movement to allies increased by 1.
Rallying Cry;Leader Maneuver;Role, Leader;4;Leader role;When rolling for Initiative, allies that can see you gain +1 to all defenses until the end of the first combat round, and +1 to Initiative.;Allies gain +1 Initiative, +1 to defenses on first combat round.
Adrenaline Rush;Leader Offense;Role, Leader, Paragon;11;Leader role;When you use a Healing power, creatures spending a Surge due to that power gain +2 to hit and +1 to Action Point rolls until the end of your next turn.;Healing grants +2 hit, +1 to Action Point Rolls.
Point Flank;Leader Offense;Role, Leader, Paragon;11;Leader role;Allies gain +1 to hit and +1 damage per tier against enemies you flank.;Flanking grants +1 hit, +1 damage per tier to allies.
Constructive Criticism;Leader Offense;Role, Leader, Paragon;11;Leader role;While you grant a power bonus to hit or damage to an ally, that ally gains +1 Crit Range.;With power bonus to hit or damage, allies gain +1 Crit Range.
Martial Prowess;Power Source;Martial;11;Martial power source; +1 Fortitude, +1 Reflex, +3 Opportunity Attack Modifier; +1 Fortitude, +1 Reflex, +3 Opportunity Attack Modifier
Divine Resolve;Power Source;Divine;11;Divine power source; +1 Fortitude, +1 Will, +6 Surge value per tier; +1 Fortitude, +1 Will, +6 Surge value per tier
Arcane Abjuration;Power Source;Arcane;11;Arcane power source; +1 Will, +1 Reflex, +3 to saves; +1 Will, +1 Reflex, +3 to saves
Primal Regeneration;Power Source;Primal;11;Primal power source; +2 Fortitude, +2 Surges; +2 Fortitude, +2 Surges
Psionic Prescience;Power Source;Psi ;11;Psi power source; +2 Will, +3 Initiative; +2 Will, +3 Initiative
Shadow Slumber;Power Source;Shadow;11;Shadow power source; +2 Reflex, +6 Death Saves; +2 Reflex, +6 Death Saves
Martial Grit;Power Source;Martial;11;Martial power source;When using Second Wind, gain +4 hit on next attack, +2 to Action Point rolls until end of next turn, and roll a save to recover the spent surge.;On Second Wind, +4 hit  on next attack, +2 to Action Point rolls until end of next turn, and save to recover  surge.
Divine Hope;Power Source;Divine;11;Divine power source;When using Second Wind, you double the healed HP, gain +2 to defenses until end of next turn, and roll a save.;On Second Wind, heal double HP, +2 to defenses until end of next turn, and roll a save.
Arcane Recovery;Power Source;Arcane;11;Arcane power source;When using an Encounter or Daily arcane power, roll 1d20. On a 17+, the power is not spent.;When using an Encounter or Daily arcane power, roll 1d20. On a 17+, the power is not spent.
Primal Ferocity;Power Source;Primal;11;Primal power source;While bloodied, +1 to hit, +2 to saves, +1 to Action Point rolls;While bloodied, +1 to hit, +2 to saves, +1 to Action Point rolls
Psionic Versatility;Power Source;Psi ;11;Psi power source;"When using a psionic At-Will attack power for the first time in an encounter, gain +1 hit with that power.
You gain an additional Level 1 At-will attack power.";"On first use of psionic At-Will attack power+1 hit with that power.
You gain an additional Level 1 At-will attack power."
Shadow Hunger;Power Source;Shadow;11;Shadow power source;When killing an enemy, gain 6 HP per tier, and +1 to Action Point rolls until end of next turn.;On kill, +6 HP per tier, and +1 to Action Point rolls until end of next turn.
Paragon Ability;Paragon Ability;Paragon, Ability;11;;Choose a Tertiary ability. Gain +1 to that ability and to your Weak ability.; +1 to one Tertiary ability and Weak Ability
Epic Perfection;Epic Ability;Epic, Ability;21;; Gain +1 to your Tertiary and Weak abilities.; +1 to Tertiary and Weak Abilities
Epic Specialization;Epic Specialization;Epic;21;;Choose one of your feats from a non-Unlimited Feat Category, other than Multiclass. You gain an additional Feat from that Category.;Gain additional feat from a category you already have.
Larger than life;Epic Might;Epic;21;;"In combat, you occupy space as a Large creature (2x2 squares).
Your reach with all melee and touch attacks is increased by 1.
(Note: Your actual height and size is not changed)";Increase size to Large, +1 reach.
Wrecking Crew;Epic Might;Epic;21;;"Once per turn, after you hit or miss with a melee or ranged attack, a ground square in the target's space is Difficult Terrain until end of the encounter.
You have Advantage on attacks against targets on Difficult Terrain.";"On melee or ranged attack, turn a square in target's space into Difficult Terrain.
Advantage vs targets on Difficult Terrain."
Irresistible Force;Epic Might;Epic;21;;"When you inflict forced movement on an enemy with an attack, the forced movement is increased by 1.
Once per turn, after you inflict forced movement on an enemy, you deal 2 damage to another enemy adjacent to it for each square of the forced movement."; +1 Forced Movement. When moving an enemy, deal 2 damage per moved square to adjacent enemy.
Immovable Object;Epic Might;Epic;21;;"Enemy Forced Movement on you is reduced by 1.
When an enemy misses you with a melee attack, as a Spontaneous Free Reaction you push it 1."; -1 enemy Forced Movement. On enemy melee miss, push 1.
Defender Multiclass;Multiclass;Defender;1;;"Choose a Defender class other than yours. That class becomes your multiclass.
Gain two Multiclass Lesser Feats.
Gain the following power: Defender Mark (Encounter) - Minor Action, Close Burst 3, targets one or two enemies within Burst. Effect: Mark the targets until end of your next turn.";Multiclass to a Defender class. Gain two Multiclass Lesser Feats. 1/encounter, mark two enemies within 3 as minor action.
Striker Multiclass;Multiclass;Striker;1;;"Choose a Striker class other than yours. That class becomes your multiclass.
Gain two Multiclass Lesser Feats.
Gain the following power: Striker Damage (Encounter) - Personal Reaction (Trigger: you hit an enemy with an attack), targets you. Effect: The attack deals an extra d6 damage per tier.";Multiclass to a Striker class. Gain two Multiclass Lesser Feats. 1/encounter, deal +d6 damage per Tier.
Leader Multiclass;Multiclass;Leader;1;;"Choose a Leader class other than yours. That class becomes your multiclass.
Gain two Multiclass Lesser Feats.
Gain the following power: Leader Healing (Daily) - Minor Action, Close Burst 5, targets you or an ally within Burst. Effect: The target spends a Surge and heals an extra 2d6 per Tier.";Multiclass to a Leader class. Gain two Multiclass Lesser Feats. 1/day, you or ally within 5 spend surge and heal +2d6/tier
Controller Multiclass;Multiclass;Controller;1;;"Choose a Controller class other than yours. That class becomes your multiclass.
Gain two Multiclass Lesser Feats.";Multiclass to a Controller class. Gain two Multiclass Lesser Feats.
